Polymyxin B,Therapeutic,"Polymyxin B is indicated for the treatment of infections of the urinary tract, meninges, and blood stream, caused by susceptible strains of Pseudomonas aeruginosa",XXTXX(1)XfLXXT(1),[H][C@]1(NC(=O)[C@H](CCN)NC(=O)[C@H](CCN)NC(=O)[C@H](CC(C)C)NC(=O)[C@@H](CC2=CC=CC=C2)NC(=O)[C@@H](CCN)NC(=O)[C@H](CCNC1=O)NC(=O)[C@H](CCN)NC(=O)[C@@H](NC(=O)[C@H](CCN)NC(=O)CCCCC(C)CC)[C@@H](C)O)[C@@H](C)O,A,B,1203.499,11,3,2,yes,7,head-to-side chain (Thr-Dab),yes,no,9-11.5 hours,92-99%,Administration by the oral route does not lead to absorption,"IM, IV, IT, OPHTALMIC, ORAL, TOPICAL",Canada,CADTH,1951,Natural,Paenibacillus polymyxa,Fermentation and Solid Phase Peptide Synthesis,https://go.drugbank.com/drugs/DB00781,https://www.accessdata.fda.gov/drugsatfda_docs/label/2012/060716s018lbl.pdf,https://drugs.ncats.io/drug/J2VZ07J96K,https://pubmed.ncbi.nlm.nih.gov/10424344/ ,,,,,,,"6-methyl-octanoyl, cycle",True
Angiotensin II,Therapeutic,Angiotensin II is a vasoconstrictor indicated for increasing blood pressure in adults with septic or other distributive shock,DRVYIHPF,CC[C@@H]([C@@H](C(N[C@H](C(N1CCC[C@H]1C(N[C@H](C(O)=O)CC2=CC=CC=C2)=O)=O)CC3=CN=CN3)=O)NC([C@@H](NC([C@H](C(C)C)NC([C@@H](NC([C@H](CC(O)=O)N)=O)CCCNC(N)=N)=O)=O)CC4=CC=C(C=C4)O)=O)C,A,B,1046.197,8,8,0,no,N.A.,N.A.,no,no,Plasma half-life < 1 min,-,,IV,US,FDA,2017,Natural,-,Synthesis,https://go.drugbank.com/drugs/DB11842,https://www.accessdata.fda.gov/drugsatfda_docs/label/2017/209360s000lbl.pdf,https://www.fda.gov/news-events/press-announcements/fda-approves-drug-treat-dangerously-low-blood-pressure,,,,,,,,"H, OH",True
Telavancin,Therapeutic,"For the treatment of complicated skin and skin structure infections (cSSSI) caused by gram-positive bacteria like methicillin-susceptible or -resistant Staphylococcus aureus, vancomycin-susceptible Enterococcus faecalis, and Streptococcus pyogenes, Streptococcus agalactiae, or Streptococcus anginosus group. Also for the treatment of adult patients with hospital-acquired bacterial pneumonia (HAP) and ventilator-associated bacterial pneumonia (VAP), known or suspected to be caused by susceptible isolates of Staphylococcus aureus (including methicillin-susceptible and methicillin-resistant S. aureus).",-,CCCCCCCCCCNCCN[C@]1(C[C@@H](O[C@H]([C@H]1O)C)O[C@@H]2[C@H]([C@@H]([C@H](O[C@H]2OC3=C4C=C5C=C3OC6=C(C=C(C=C6)[C@H]([C@H](C(=O)N[C@H](C(=O)N[C@H]5C(=O)N[C@@H]7C8=CC(=C(C=C8)O)C9=C(C(=C(C=C9[C@H](NC(=O)[C@H]([C@@H](C1=CC(=C(O4)C=C1)Cl)O)NC7=O)C(=O)O)O)CNCP(=O)(O)O)O)CC(=O)N)NC(=O)[C@@H](CC(C)C)NC)O)Cl)CO)O)O)C,B,B,1755.65,N.A.,N.A.,N.A.,yes,multicyclic,C-O-C; C-C,yes,yes - 2 sugars, 8 ± 1.5 hours,>90%,Telavancin has poor bioavailability and must be administered over 30-120 minutes IV.,IV,US,FDA,2009,Analogue,Vancomycin,Semisynthesis (fermentation + synthesis),https://go.drugbank.com/drugs/DB06402,https://pubchem.ncbi.nlm.nih.gov/compound/Telavancin#section=ATC-Code,https://www.accessdata.fda.gov/drugsatfda_docs/nda/2013/022407Orig1s000MicroR.pdf,https://www.accessdata.fda.gov/drugsatfda_docs/label/2009/022110s000lbl.pdf,,,,,,,"CH3, OH",True
Telaprevir,Therapeutic,"Telaprevir, when used in combination with Ribavirin, Peginterferon alfa-2a, and Peginterferon alfa-2b is indicated for use in the treatment of chronic HCV genotype 1 infection in adults",-,CCC[C@@H](C(=O)C(=O)NC1CC1)NC(=O)[C@@H]2[C@H]3CCC[C@H]3CN2C(=O)[C@H](C(C)(C)C)NC(=O)[C@H](C4CCCCC4)NC(=O)C5=NC=CN=C5,A,B,679.863,5,0,0,no,N.A.,N.A.,no,no,Telaprevir has a half-life of elimination of 4.0-4.7 hours after a single dose and an effective half life of 9-11 hours at steady state,59-76%,-,ORAL,US,FDA,2011,Heterologous,-,-,https://go.drugbank.com/drugs/DB05521,https://www.accessdata.fda.gov/drugsatfda_docs/label/2011/201917lbl.pdf,,,,,,,,,"pyrazinoyl, 3-amino-N-cyclopropyl-2-oxohexanamide",True
Boceprevir,Therapeutic,"Boceprevir, when used in combination with Ribavirin, Peginterferon alfa-2a, and Peginterferon alfa-2b is indicated for use in the treatment of chronic HCV genotype 1 infection in adults",-,CC1([C@@H]2[C@H]1[C@H](N(C2)C(=O)[C@H](C(C)(C)C)NC(=O)NC(C)(C)C)C(=O)NC(CC3CCC3)C(=O)C(=O)N)C,A,B,519.687,4,0,0,no,N.A.,N.A.,no,no,Boceprevir has a mean half-life of elimination of 3.4 hours,75%,-,"SC, ORAL",US,FDA,2011,Heterologous,-,Synthesis,https://go.drugbank.com/drugs/DB08873,https://www.accessdata.fda.gov/drugsatfda_docs/label/2011/202258lbl.pdf,,,,,,,,,"CONH-tBu, 3-amino-4-cyclobutyl-2-oxobutanamide",True
Viomycin,Therapeutic,Viomycin is an essential component in the drug cocktail currently used to fight infections of Mycobacterium tuberculosis.,XXSSXX,C1[C@@H](N=C(N[C@H]1O)N)[C@H]2C(=O)NC[C@@H](C(=O)N[C@H](C(=O)N[C@H](C(=O)N/C(=C\NC(=O)N)/C(=O)N2)CO)CO)NC(=O)C[C@H](CCCN)N,A,A,685.7,7,2,0,yes,5,head-to-side chain (Arg-Dap),no,no,-,-,-,IV,US,FDA,1953,Natural,actinomycete Streptomyces puniceus,Fermentation,https://go.drugbank.com/drugs/DB06827,https://www.sciencedirect.com/topics/neuroscience/viomycin,https://drugs.ncats.io/drug/YVU35998K5,https://pubchem.ncbi.nlm.nih.gov/compound/Viomycin,,,,,,,"H, cycle",True
Demoxytocin,Therapeutic,Analogueue of oxytocin. Labour induction or augmentation,XYIQNCPLG-NH2,CC[C@H](C)[C@H]1C(=O)N[C@H](C(=O)N[C@H](C(=O)N[C@@H](CSSCCC(=O)N[C@H](C(=O)N1)CC2=CC=C(C=C2)O)C(=O)N3CCC[C@H]3C(=O)N[C@@H](CC(C)C)C(=O)NCC(=O)N)CC(=O)N)CCC(=O)N,A,A,992.18,9,8,0,yes,6,side chain-to-side chain (disulfide),no,no,-,-,-,BUCCAL,-,-,1971,Analogue,Oxytocin,Synthesis,https://go.drugbank.com/drugs/DB13798,https://www.mims.com/malaysia/drug/info/demoxytocin?mtype=generic,https://www.ebi.ac.uk/chebi/searchId.do?chebiId=CHEBI:135900,https://drugs.ncats.io/drug/449224,https://www.ebi.ac.uk/chebi/searchId.do?chebiId=CHEBI:135900,,,,,,"deamino, NH2",True
Pralmorelin,Diagnostic,It is used as a diagnostic agent in a single-dose formulation for the assessment of growth hormone deficiency (GHD),aXAWfK-NH2,C[C@H](C(=O)N[C@H](CC1=CC2=CC=CC=C2C=C1)C(=O)N[C@@H](C)C(=O)N[C@@H](CC3=CNC4=CC=CC=C43)C(=O)N[C@H](CC5=CC=CC=C5)C(=O)N[C@@H](CCCCN)C(=O)N)N,B,B,817.992,6,3,3,no,N.A.,N.A.,no,no,-,-,-,ORAL,JP,PMDA,2004,Analogue,Met-enkephalin,Synthesis,https://drugs.ncats.io/drug/E6S6E1F19M,https://link.springer.com/article/10.2165/00126839-200405040-00011,https://onlinelibrary.wiley.com/doi/full/10.1002/rco2.9,,,,,,,,"H, NH2",True
Enviomycin,Therapeutic,Antibiotic drug acts as an antitubercular agent with less ototoxicity than tuberactinomycin.,XXSSXX,C1CN=C(NC1C2C(=O)NCC(C(=O)NC(C(=O)NC(C(=O)N/C(=C\NC(=O)N)/C(=O)N2)CO)CO)NC(=O)CC(C(CCN)O)N)N,A,A,685.7,7,2,0,yes,5,head-to-side chain (Arg-Dap),no,no,-,-,-,-,JP,PMDA,1975,Natural,Streptomyces griseoverticillatus var. tuberacticus,Fermentation,https://go.drugbank.com/drugs/DB08993,https://books.google.it/books?id=M1p9AgAAQBAJ&pg=PA24&lpg=PA24&dq=enviomycin+approval+year+%221975%22&source=bl&ots=6SSnFSyiNH&sig=ACfU3U1ffYbzh1ISV8vZzq8sp2fjF9eh-w&hl=en&sa=X&ved=2ahUKEwie7NaMjeLuAhWTFMAKHTjxCiQQ6AEwB3oECAkQAg#v=onepage&q=enviomycin%20approval%20year%20%221975%22&f=false,,,,,,,,,"H, cycle",True
Lutetium Lu 177 dotatate,Therapeutic,"Treatment of somatostatin receptor-positive gastroenteropancreatic neuroendocrine tumors (GEP-NETs), including foregut, midgut, and hindgut neuroendocrine tumors in adults.",XFCYWKTCT,C[C@H]([C@H]1C(=O)N[C@@H](CSSC[C@@H](C(=O)N[C@H](C(=O)N[C@@H](C(=O)N[C@H](C(=O)N1)CCCCN)CC2=CNC3=CC=CC=C32)CC4=CC=C(C=C4)O)NC(=O)[C@@H](CC5=CC=CC=C5)NC(=O)CN6CCN(CCN(CCN(CC6)CC(=O)[O-])CC(=O)[O-])CC(=O)[O-])C(=O)N[C@@H]([C@@H](C)O)C(=O)O)O,A,A,1609.55,9,8,0,yes,6,side chain-to-side chain (disulfide),no,no,71 (± 28) hours,The non-radioactive form of lutetium dotatate is 43% bound to human plasma proteins,-,IV,EU - US,EMA - FDA,2016 - 2018,Analogue,Somatostatin,Synthetic,https://go.drugbank.com/drugs/DB13985,https://www.fda.gov/drugs/resources-information-approved-drugs/fda-approves-lutetium-lu-177-dotatate-treatment-gep-nets,https://www.ema.europa.eu/en/documents/assessment-report/lutathera-epar-public-assessment-report_en.pdf,,,,,,,,"DOTA, OH",True
Ombitasvir,Therapeutic,"When used in combination with Paritaprevir and Ritonavir (as the fixed dose product Technivie), Ombitasvir is indicated in combination with Ribavirin for the treatment of patients with genotype 4 chronic hepatitis C virus (HCV) infection without cirrhosis. When used in combination with Paritaprevir, Ritonavir, and Dasabuvir (as the fixed dose product Viekira Pak), Ombitasvir is indicated for the treatment of HCV genotype 1b and ,when combined with Ribavirin, for the treatment of HCV genotype 1a.",XVPXPVX,CC(C)[C@@H](C(=O)N1CCC[C@H]1C(=O)NC2=CC=C(C=C2)[C@@H]3CC[C@H](N3C4=CC=C(C=C4)C(C)(C)C)C5=CC=C(C=C5)NC(=O)[C@@H]6CCCN6C(=O)[C@H](C(C)C)NC(=O)OC)NC(=O)OC,A,B,894.127,5,4,0,no,N.A.,N.A.,no,no,21-25 hours,99.9%,48%,ORAL,US,FDA,2014,Heterologous,-,-,https://go.drugbank.com/drugs/DB09296,https://www.accessdata.fda.gov/scripts/cder/daf/index.cfm?event=overview.process&varApplNo=206619,,,,,,,,,"MeOAc, 4,4'-(1-(4-(tert-butyl)phenyl)pyrrolidine-2,5-diyl)dianiline",True
Spaglumic acid,Therapeutic,Allergic rhinitis and conjunctivitis,Ac-DE,CC(=O)N[C@@H](CC(=O)O)C(=O)N[C@@H](CCC(=O)O)C(=O)O,A,B,304.255,2,2,0,no,N.A.,N.A.,no,no,-,-,-,EYE DROPS,Portugal and Greece,-,-,Natural,N-Acetylaspartylglutamic acid,-,https://go.drugbank.com/drugs/DB08835,https://drugs.ncats.io/substance/X81L78B3RB,,,,,,,,,"acetyl, OH",True
Perindopril,Therapeutic,"For the treatment of mild to moderate essential hypertension, mild to moderate congestive heart failure, and to reduce the cardiovascular risk of individuals with hypertension or post-myocardial infarction and stable coronary disease.",XAX,CCC[C@@H](C(=O)OCC)N[C@@H](C)C(=O)N1[C@H]2CCCC[C@H]2C[C@H]1C(=O)O,A,B,368.474,3,1,0,no,N.A.,N.A.,no,no,"Perindopril, 1.2 hours; Peridoprilat, 30-120 hours. The long half life of peridoprilat is due to its slow dissociation from ACE binding sites.",10-20% (perindoprilat),65-75% (perindopril); 20% (perindoprilat),ORAL,EU,EMA,1988,Heterologous,Captopril (derived from viper's venom),-,https://go.drugbank.com/drugs/DB00790,https://www.ema.europa.eu/en/medicines/human/referrals/coversyl-0,,,,,,,,,"ethyl-pentanoyl, OH",True
Ramipril,Therapeutic,"For the management of mild to severe hypertension. May be used to reduce cardiovascular mortality following myocardial infarction in hemodynamically stable individuals who develop clinical signs of congestive heart failure within a few days following myocardial infarction. To reduce the rate of death, myocardial infarction and stroke in individuals at high risk of cardiovascular events. May be used to slow the progression of renal disease in individuals with hypertension, diabetes mellitus and microalubinuria or overt nephropathy.",XAX,CCOC(=O)[C@H](CCC1=CC=CC=C1)N[C@@H](C)C(=O)N2[C@H]3CCC[C@H]3C[C@H]2C(=O)O,A,B,416.518,3,1,0,no,N.A.,N.A.,no,no,"Plasma concentrations of ramiprilat decline in a triphasic manner. Initial rapid decline represents distribution into tissues and has a half life of 2-4 hours. The half life of the apparent elimination phase is 9-18 hours, which is thought to represent clearance of free drug. The half-life of the terminal elimination phase is > 50 hours and thought to represent clearance of drug bound to ACE due to its slow dissociation. The half life of ramiprilat after multiple daily doses (MDDs) is dose-dependent, ranging from 13-17 hours with 5-10 mg MDDs to 27-36 hours for 2.5 mg MDDs.",Protein binding of ramipril is about 73% and that of ramiprilat about 56%.,"The absolute bioavailabilities of ramipril and ramiprilat were 28% and 44%, respectively, when oral administration was compared to intravenous administration.",ORAL,US,FDA,1991,Heterologous,Captopril (derived from viper's venom),-,https://go.drugbank.com/drugs/DB00178,https://www.accessdata.fda.gov/drugsatfda_docs/label/2013/019901s060lbl.pdf,,,,,,,,,"ethyl-4-phenyl butanoyl, OH",True
Quinapril,Therapeutic,Quinapril is indicated for the treatment of hypertension and as an adjunct therapy in the treatment of heart failure. ,XAX,CCOC(=O)[C@H](CCC1=CC=CC=C1)N[C@@H](C)C(=O)N2CC3=CC=CC=C3C[C@H]2C(=O)O,A,B,438.524,3,1,0,no,N.A.,N.A.,no,no,The active metabolite quinaprilat has an elimination half life of 2.3 hours,Quinapril and the active metabolite quinaprilat are 97% protein bound in plasma.,Quinapril is 50-80% bioavailable.,ORAL,US,FDA,1991,Heterologous,Captopril (derived from viper's venom),-,https://go.drugbank.com/drugs/DB00881,,,,,,,,,,"ethyl-4-phenyl butanoyl, OH",True
Trandolapril,Therapeutic,"For the treatment of mild to moderate hypertension, as an adjunct in the treatment of congestive heart failure (CHF), to improve survival following myocardial infarction (MI) in individuals who are hemodynamically stable and demonstrate symptoms of left ventricular systolic dysfunction or signs of CHF within a few days following acute MI, and to slow progression of renal disease in hypertensive patients with diabetes mellitus and microalbuminuria or overt nephropathy.",XAX,CCOC(=O)[C@H](CCC1=CC=CC=C1)N[C@@H](C)C(=O)N2[C@H]3CCCC[C@@H]3C[C@H]2C(=O)O,A,B,430.545,3,1,0,no,N.A.,N.A.,no,no,"The elimination half lives of trandolapril and trandolaprilat are about 6 and 10 hours, respectively, but, similar to all ACE inhibitors, trandolaprilat also has a prolonged terminal elimination phase that involves a small fraction of administered drug. This likely represents drug binding to plasma and tissue ACE. The effective half life of elimination for trandolaprilat is 16-24 hours.",Serum protein binding of trandolapril is ~ 80% (independent of concentration and not saturable) while that of trandolaprilat is 65 to 94% (concentration-dependent and saturable).,Extensive first pass metabolism results in a low bioavailability of 4-14%,ORAL,US,FDA,1996,Heterologous,Captopril (derived from viper's venom),-,https://go.drugbank.com/drugs/DB00519,https://www.accessdata.fda.gov/drugsatfda_docs/nda/96/020528Orig1s000rev.pdf,,,,,,,,,"ethyl-4-phenyl butanoyl, OH",True
Argatroban,Therapeutic,"Argatroban is indicated for prevention and treatment of thrombosis caused by heparin-induced thrombocytopenia (HIT). It is also indicated for use in patients with, or at risk for, HIT who are undergoing percutaneous coronary intervention.",XRX,C[C@@H]1CCN([C@H](C1)C(=O)O)C(=O)[C@H](CCCN=C(N)N)NS(=O)(=O)C2=CC=CC3=C2NCC(C3)C,B,B,508.64,3,1,0,no,N.A.,N.A.,no,no,39 and 51 minutes,54%,Bioavailability is 100% (intravenous).,IV,US,FDA,2000,Heterologous,-,Synthesis,https://go.drugbank.com/drugs/DB00278,https://www.accessdata.fda.gov/drugsatfda_docs/label/2011/022485lbl.pdf,https://www.accessdata.fda.gov/drugsatfda_docs/nda/2000/20-883_Acova.cfm,,,,,,,,"3-methyl-1,2,3,4-tetrahydroquinoline-8-sulfonic acid, OH",True
Difelikefalin,Therapeutic,Moderate-to-severe pruritus associated with chronic kidney disease in adults undergoing hemodialysis,fflkX,CC(C)C[C@H](C(=O)N[C@H](CCCCN)C(=O)N1CCC(CC1)(C(=O)O)N)NC(=O)[C@@H](CC2=CC=CC=C2)NC(=O)[C@@H](CC3=CC=CC=C3)N,A,A,679.863,5,0,4,no,N.A.,N.A.,no,no,23-31 hours,23-28%,100%,IV,US,FDA,2021,,,Synthesis,https://go.drugbank.com/drugs/DB11938,https://www.accessdata.fda.gov/drugsatfda_docs/label/2021/214916s000lbl.pdf,,,,,,,,,"H, γ-(4-N-piperidinyl)amino carboxylic acid",True
Setmelanotide,Therapeutic,"Indicated for chronic weight management in patients with obesity due to pro-opiomelanocortin deficiency, proprotein subtilisin/kexin type 1 deficiency, or leptin receptor deficiency",Ac-RCaHfRWC-NH2,C[C@@H]1C(=O)N[C@H](C(=O)N[C@@H](C(=O)N[C@H](C(=O)N[C@H](C(=O)N[C@@H](CSSC[C@@H](C(=O)N1)NC(=O)[C@H](CCCN=C(N)N)NC(=O)C)C(=O)N)CC2=CNC3=CC=CC=C32)CCCN=C(N)N)CC4=CC=CC=C4)CC5=CN=CN5,A,,1117.32,8,6,2,yes,7,side chain-to-side chain (disulfide),no,no,Elimination half-life of approximately 11 hours,79.1%,-,SC,US-EU,EMA - FDA,2016 (orphan) - 2020,,,Synthesis,https://go.drugbank.com/drugs/DB11700,https://www.ema.europa.eu/en/documents/assessment-report/imcivree-epar-public-assessment-report_en.pdf,,,,,,,,,"acetyl, NH2",True
Vosoritide,Therapeutic,An analogue of C-type naturietic peptide used to promote bone growth in pediatric patients with achondroplasia.,PGQEHPNARKYKGANKKGLSKGCFGLKLDRIGSMSGLGC,CC[C@H](C)[C@H]1C(=O)NCC(=O)N[C@H](C(=O)N[C@H](C(=O)N[C@H](C(=O)NCC(=O)N[C@H](C(=O)NCC(=O)N[C@@H](CSSC[C@@H](C(=O)N[C@H](C(=O)NCC(=O)N[C@H](C(=O)N[C@H](C(=O)N[C@H](C(=O)N[C@H](C(=O)N[C@H](C(=O)N1)CCCNC(=N)N)CC(=O)O)CC(C)C)CCCCN)CC(C)C)CC2=CC=CC=C2)NC(=O)CNC(=O)[C@H](CCCCN)NC(=O)[C@H](CO)NC(=O)[C@H](CC(C)C)NC(=O)CNC(=O)[C@H](CCCCN)NC(=O)[C@H](CCCCN)NC(=O)[C@H](CC(=O)N)NC(=O)[C@H](C)NC(=O)CNC(=O)[C@H](CCCCN)NC(=O)[C@H](CC3=CC=C(C=C3)O)NC(=O)[C@H](CCCCN)NC(=O)[C@H](CCCNC(=N)N)NC(=O)[C@H](C)NC(=O)[C@H](CC(=O)N)NC(=O)[C@@H]4CCCN4C(=O)[C@H](CC5=CN=CN5)NC(=O)[C@H](CCC(=O)O)NC(=O)[C@H](CCC(=O)N)NC(=O)CNC(=O)[C@@H]6CCCN6)C(=O)O)CC(C)C)CO)CCSC)CO,A,B,4102.78,39,39,0,yes,17,side chain-to-side chain (disulfide),no,no,21.0-27.9 minutes,-,-,SC,US-EU,EMA - FDA,2021,Analogue,C-type natriuretic pepetide,-,https://go.drugbank.com/drugs/DB11928,https://www.accessdata.fda.gov/drugsatfda_docs/label/2021/214938s000lbl.pdf,https://www.ema.europa.eu/en/documents/product-information/voxzogo-epar-product-information_en.pdf,https://www.ema.europa.eu/en/documents/assessment-report/voxzogo-epar-public-assessment-report_en.pdf,,,,,,,"H, OH",True
Tirzepatide,Therapeutic,Tirzepatide is a GIP and GLP-1 receptor agonist that controls blood sugar levels in adults with type 2 diabetes.,YXEGTFTSDYSIXLDKIAQKAFVQWLIAGGPSSGAPPPS,CC[C@H](C)[C@@H](C(=O)N[C@@H](C)C(=O)N[C@@H](CCC(=O)N)C(=O)N[C@@H](CCCCN)C(=O)N[C@@H](C)C(=O)N[C@@H](CC1=CC=CC=C1)C(=O)N[C@@H](C(C)C)C(=O)N[C@@H](CCC(=O)N)C(=O)N[C@@H](CC2=CNC3=CC=CC=C32)C(=O)N[C@@H](CC(C)C)C(=O)N[C@@H]([C@@H](C)CC)C(=O)N[C@@H](C)C(=O)NCC(=O)NCC(=O)N4CCC[C@H]4C(=O)N[C@@H](CO)C(=O)N[C@@H](CO)C(=O)NCC(=O)N[C@@H](C)C(=O)N5CCC[C@H]5C(=O)N6CCC[C@H]6C(=O)N7CCC[C@H]7C(=O)N[C@@H](CO)C(=O)N)NC(=O)[C@H](CCCCNC(=O)CCCCCCCCCCCCCCCCCCC(=O)N[C@@H](CCC(=O)NCCOCCOCC(=O)NCCOCCOCC(=O)O)C(=O)O)NC(=O)[C@H](CC(=O)O)NC(=O)[C@H](CC(C)C)NC(=O)C(C)(C)NC(=O)[C@H]([C@@H](C)CC)NC(=O)[C@H](CO)NC(=O)[C@H](CC8=CC=C(C=C8)O)NC(=O)[C@H](CC(=O)O)NC(=O)[C@H](CO)NC(=O)[C@H]([C@@H](C)O)NC(=O)[C@H](CC9=CC=CC=C9)NC(=O)[C@H]([C@@H](C)O)NC(=O)CNC(=O)[C@H](CCC(=O)O)NC(=O)C(C)(C)NC(=O)[C@H](CC1=CC=C(C=C1)O)N,B,B,4813.53,39,37,2,no,N.A.,N.A.,yes,no,Approximately 5 days,99% (albumin),The absolute bioavailability of tirzepatide was 80% after subcutaneous administration.,SC,US,FDA,2022,,,Synthetic,https://go.drugbank.com/drugs/DB15171,https://www.fda.gov/news-events/press-announcements/fda-approves-novel-dual-targeted-treatment-type-2-diabetes,https://pubchem.ncbi.nlm.nih.gov/compound/156588324#section=Biologic-Description ,,,,,,,,"H, NH2",True
Rezafungin,Therapeutic,Rezafungin is an echinocandin antifungal that is used for the treatment of candidemia and invasive candidiasis.,XXTXXTX,CCCCCOC1=CC=C(C=C1)C2=CC=C(C=C2)C3=CC=C(C=C3)C(=O)N[C@H]4C[C@H]([C@H](NC(=O)[C@@H]5[C@H]([C@H](CN5C(=O)[C@@H](NC(=O)[C@@H](NC(=O)[C@@H]6C[C@H](CN6C(=O)[C@@H](NC4=O)[C@@H](C)O)O)[C@@H]([C@H](C7=CC=C(C=C7)O)O)O)[C@@H](C)O)C)O)OCC[N+](C)(C)C)O,A,B,1225.6,7,2,0,yes,6,"head-to-side chain (g,d- substituted (S)-2,5-diaminopentanoic acid)",yes,no,152 hours.,"Between 87.5% to 93.6% in patients, and between 95.6% to >98.6% in healthy adults.",Bioavailability is 100% (intravenous).,IV,US,FDA,2023,Analogue,Echinocandins class drug,Semisynthesis (fermentation from anidulafungin + synthesis),https://go.drugbank.com/drugs/DB16310,https://pubchem.ncbi.nlm.nih.gov/compound/Rezafungin#:~:text=Rezafungin%20%7C%20C63H85N8O17%2B%20%2D%20PubChem,https://www.fda.gov/media/164723/download,,,,,,,,"4''-(pentyloxy)-[1,1':4',1''-terphenyl]-4-carboxamide, cycle",True
Motixafortide,Therapeutic,Motixafortide is a CXCR4 antagonists and hematopoietic stem cell mobilizer used for treating multiple myeloma.,RRXCYXKKPYRXCR,C1C[C@H]2C(=O)N[C@H](C(=O)N[C@H](C(=O)N[C@H](C(=O)N[C@@H](CSSC[C@@H](C(=O)N[C@H](C(=O)N[C@H](C(=O)N[C@H](C(=O)N[C@H](C(=O)N2C1)CCCCN)CCCCN)CCCNC(=O)N)CC3=CC=C(C=C3)O)NC(=O)[C@H](CC4=CC5=CC=CC=C5C=C4)NC(=O)[C@H](CCCNC(=N)N)NC(=O)[C@H](CCCNC(=N)N)NC(=O)C6=CC=C(C=C6)F)C(=O)N[C@@H](CCCNC(=N)N)C(=O)N)CCCNC(=O)N)CCCNC(=N)N)CC7=CC=C(C=C7)O,A,B,2159.6,14,11,0,yes,10,sid,no,no,Approximately 2 hours.,>99%,-,SC,US,FDA,2023,,,Synthetic,https://go.drugbank.com/drugs/DB14939,https://pubchem.ncbi.nlm.nih.gov/compound/Motixafortide ,https://www.accessdata.fda.gov/drugsatfda_docs/label/2023/217159s000lbl.pdf ,,,,,,,,"Bz(4-F), NH2",True
Flotufolastat F-18,Diagnostic,Flotufolastat F-18 is a radiopharmaceutical diagonistic agent used in PET imaging to visualise prostate cancers with PSMA-positive lesions that suspect metathesis or recurrence.,XeXkXXeXE,CC(C)(C)[Si](C1=CC=C(C=C1)C(=O)NC[C@H](C(=O)N[C@H](CCCCNC(=O)CCC(=O)NCCC[C@H](C(=O)O)NC(=O)CC[C@@H](C(=O)O)NC(=O)N[C@@H](CCC(=O)O)C(=O)O)C(=O)O)NC(=O)CC[C@@H](C(=O)O)N2CCN(CCN(CCN(CC2)CC(=O)O)CC(=O)O)CC(=O)O)(C(C)(C)C)[18F],A,B,1470.63,9,1,0,no,N.A.,N.A.,no,no,Physical half-life is 109.8 minutes,-,Bioavailability is 100% (intravenous) but 7% is excreted in the urine after 2 hours and 15% execreted at 4.5 hours.,IV,US,FDA,2023,,,Synthetic,https://go.drugbank.com/drugs/DB17851 ,https://pubchem.ncbi.nlm.nih.gov/compound/Flotufolastat-_18F#section=2D-Structure ,https://www.accessdata.fda.gov/drugsatfda_docs/label/2023/216023s000lbl.pdf ,https://patents.google.com/patent/WO2023047138A1/en?oq=WO2023047138A1 ,,,,,,,"DOTA, OH",True
Pentagastrin,Diagnostic,"Pentagastrin is a gastrin-like molecule used as a diagnostic aid for the evaluation of gastric acid secretory function, gastric hypersecretion, and Zollinger-Ellison tumors.",Boc-bAla-Trp-Met-Asp-Phe-NH2,CC(C)(C)OC(=O)NCCC(=O)N[C@@H](CC1=CNC2=CC=CC=C21)C(=O)N[C@@H](CCSC)C(=O)N[C@@H](CC(=O)O)C(=O)N[C@@H](CC3=CC=CC=C3)C(=O)N,A,,767.9,10,1,0,no,N.A.,N.A.,no,no,10 minutes or less,N.A.,N.A.,IV,US,FDA,2012,Analogue,Gastrin-like peptide,Synthetic,https://go.drugbank.com/drugs/DB00183,https://pubchem.ncbi.nlm.nih.gov/compound/Pentagastrin,,,,,,,,,"Boc, NH2",True
